{
  "$schema": "https://json-schema.org/draft/2020-12/schema",
  "title": "HTML artifact payload",
  "description": "A self-contained HTML document to review: inline styles, data-URI images and fonts. External resources do not load inside the view.",
  "type": "object",
  "required": ["html"],
  "additionalProperties": false,
  "properties": {
    "title": { "type": "string", "maxLength": 200, "description": "What the artifact is, shown above it" },
    "html": { "type": "string", "minLength": 1, "maxLength": 2000000, "description": "The document, complete with <style> elements" },
    "notes": { "type": "string", "maxLength": 4000, "description": "What the agent wants the reviewer to look at, as markdown" },
    "viewport": {
      "type": "string",
      "enum": ["desktop", "tablet", "phone"],
      "description": "The width to open the artifact at; the reviewer can switch"
    }
  }
}
